{
  "$id": "https://douglaskent.com/schemas/resume",
  "$schema": "https://json-schema.org/draft-04/schema#",
  "title": "Resume Schema",
  "type": "object",
  "additionalProperties": false,
  "properties": {
    "$schema": {
      "type": "string"
    },
    "basics": {
      "type": "object",
      "additionalProperties": true,
      "properties": {
        "name": {
          "type": "string"
        },
        "label": {
          "type": "string",
          "description": "e.g. Web Developer"
        },
        "metaTitle": {
          "type": "string",
          "description": "The served page's <title> and og:title. Kept under 60 characters because search results truncate there, so it is deliberately shorter than `label`."
        },
        "metaDescription": {
          "type": "string",
          "description": "The served page's <meta name=\"description\">. Kept under 160 characters because search results truncate there."
        },
        "bio": {
          "type": "string",
          "description": "Third-person long-form description of Douglas, used for Person.description in the JSON-LD graph and nowhere else. Deliberately distinct from the first-person summary1/summary2/summary7 paragraphs the page renders, which read as the site speaking rather than as metadata about its subject, and from metaDescription, which is capped near 160 characters because search results truncate there. Uncapped: the graph has room for the full prose. It necessarily restates the same facts as the summary fields in a different voice and nothing verifies the two agree, so edit them together. If absent, resume-jsonld-plugin.ts falls back to the summary paragraphs and warns."
        },
        "image": {
          "type": "string",
          "description": "URL (as per RFC 3986) to a image in JPEG or PNG format"
        },
        "email": {
          "type": "string",
          "description": "e.g. thomas@gmail.com",
          "format": "email"
        },
        "phone": {
          "type": "string",
          "description": "Phone numbers are stored as strings so use any format you like, e.g. 712-117-2923"
        },
        "url": {
          "type": "string",
          "description": "URL (as per RFC 3986) to your website, e.g. personal homepage",
          "format": "uri"
        },
        "summary1": {
          "type": "string",
          "description": "Write a biography about yourself"
        },
        "summary2": {
          "type": "string",
          "description": "Write a biography about yourself"
        },
        "summary3": {
          "type": "string",
          "description": "Write a biography about yourself"
        },
        "location": {
          "type": "object",
          "additionalProperties": true,
          "properties": {
            "address": {
              "type": "string",
              "description": "To add multiple address lines, use \n. For example, 1234 Gl�cklichkeit Stra�e\nHinterhaus 5. Etage li."
            },
            "postalCode": {
              "type": "string"
            },
            "city": {
              "type": "string"
            },
            "countryCode": {
              "type": "string",
              "description": "code as per ISO-3166-1 ALPHA-2, e.g. US, AU, IN"
            },
            "region": {
              "type": "string",
              "description": "The general region where you live. Can be a US state, or a province, for instance."
            }
          }
        },
        "profiles": {
          "type": "array",
          "description": "Specify any number of social networks that you participate in",
          "additionalItems": false,
          "items": {
            "type": "object",
            "additionalProperties": true,
            "properties": {
              "network": {
                "type": "string",
                "description": "e.g. Facebook or Twitter"
              },
              "username": {
                "type": "string",
                "description": "e.g. neutralthoughts"
              },
              "url": {
                "type": "string",
                "description": "e.g. https://twitter.example.com/neutralthoughts"
              }
            }
          }
        }
      }
    },
    "areasOfExpertise": {
      "type": "array",
      "items": {
        "type": "string"
      }
    },
    "work": {
      "type": "array",
      "additionalItems": false,
      "items": {
        "type": "object",
        "additionalProperties": false,
        "required": ["id"],
        "properties": {
          "id": {
            "type": "string",
            "description": "Permanent opaque identifier. Assigned once at creation and never changed. Carries no information about the entry and must never be parsed, sorted on, or regenerated.",
            "pattern": "^[a-z0-9]{8}$"
          },
          "company": {
            "type": "string",
            "description": "e.g. Facebook"
          },
          "location": {
            "type": "string",
            "description": "e.g. Menlo Park, CA. Currently unused, reserved for future entries."
          },
          "position": {
            "type": "string",
            "description": "e.g. Software Engineer"
          },
          "website": {
            "type": "string",
            "description": "e.g. https://facebook.example.com. Deliberately not constrained to format uri: several entries store the empty string."
          },
          "startDate": {
            "type": "string",
            "description": "Month the role began, YYYY-MM. e.g. 2026-05",
            "pattern": "^\\d{4}-\\d{2}$"
          },
          "endDate": {
            "type": "string",
            "description": "Month the role ended, YYYY-MM, or the literal \"present\" for a current role.",
            "pattern": "^(\\d{4}-\\d{2}|present)$"
          },
          "summary": {
            "type": "string",
            "description": "Give an overview of your responsibilities at the company"
          },
          "highlights": {
            "type": "array",
            "description": "Specify multiple accomplishments",
            "additionalItems": false,
            "items": {
              "type": "string",
              "description": "e.g. Increased profits by 20% from 2011-2012 through viral advertising"
            }
          },
          "showOnShort": {
            "type": "boolean",
            "description": "SHow be visible when the resume is not extended"
          },
          "notable": {
            "type": "boolean",
            "description": "SHow be visible in the JSON-LD"
          },
          "skills": {
            "type": "array",
            "description": "Skill names exercised in this role",
            "additionalItems": false,
            "items": {
              "type": "string",
              "description": "e.g. TypeScript"
            }
          },
          "personal": {
            "type": "boolean",
            "description": "Personal project rather than an engagement for an employer or client"
          },
          "contract": {
            "type": "boolean",
            "description": "Contract or consulting engagement rather than direct employment"
          },
          "remote": {
            "type": "boolean",
            "description": "Work was performed remotely"
          }
        }
      }
    },
    "volunteer": {
      "type": "array",
      "additionalItems": false,
      "items": {
        "type": "object",
        "additionalProperties": true,
        "properties": {
          "organization": {
            "type": "string",
            "description": "e.g. Facebook"
          },
          "position": {
            "type": "string",
            "description": "e.g. Software Engineer"
          },
          "url": {
            "type": "string",
            "description": "e.g. https://facebook.example.com",
            "format": "uri"
          },
          "startDate": {
            "type": "string",
            "description": "resume.json uses the ISO 8601 date standard e.g. 2014-06-29",
            "format": "date"
          },
          "endDate": {
            "type": "string",
            "description": "e.g. 2012-06-29",
            "format": "date"
          },
          "summary": {
            "type": "string",
            "description": "Give an overview of your responsibilities at the company"
          },
          "highlights": {
            "type": "array",
            "description": "Specify accomplishments and achievements",
            "additionalItems": false,
            "items": {
              "type": "string",
              "description": "e.g. Increased profits by 20% from 2011-2012 through viral advertising"
            }
          }
        }
      }
    },
    "education": {
      "type": "array",
      "additionalItems": false,
      "items": {
        "type": "object",
        "additionalProperties": true,
        "properties": {
          "institution": {
            "type": "string",
            "description": "e.g. Massachusetts Institute of Technology"
          },
          "area": {
            "type": "string",
            "description": "e.g. Arts"
          },
          "studyType": {
            "type": "string",
            "description": "e.g. Bachelor"
          },
          "startDate": {
            "type": "string",
            "description": "Year study began, YYYY. e.g. 1977",
            "pattern": "^\\d{4}$"
          },
          "endDate": {
            "type": "string",
            "description": "Year study ended, YYYY. e.g. 1980",
            "pattern": "^\\d{4}$"
          },
          "gpa": {
            "type": "string",
            "description": "grade point average, e.g. 3.67/4.0"
          },
          "courses": {
            "type": "array",
            "description": "List notable courses/subjects",
            "additionalItems": false,
            "items": {
              "type": "string",
              "description": "e.g. H1302 - Introduction to American history"
            }
          }
        }
      }
    },
    "awards": {
      "type": "array",
      "description": "Specify any awards you have received throughout your professional career",
      "additionalItems": false,
      "items": {
        "type": "object",
        "additionalProperties": true,
        "properties": {
          "title": {
            "type": "string",
            "description": "e.g. One of the 100 greatest minds of the century"
          },
          "date": {
            "type": "string",
            "description": "e.g. 1989-06-12",
            "format": "date"
          },
          "awarder": {
            "type": "string",
            "description": "e.g. Time Magazine"
          },
          "summary": {
            "type": "string",
            "description": "e.g. Received for my work with Quantum Physics"
          }
        }
      }
    },
    "publications": {
      "type": "array",
      "description": "Specify your publications through your career",
      "additionalItems": false,
      "items": {
        "type": "object",
        "additionalProperties": true,
        "properties": {
          "name": {
            "type": "string",
            "description": "e.g. The World Wide Web"
          },
          "publisher": {
            "type": "string",
            "description": "e.g. IEEE, Computer Magazine"
          },
          "releaseDate": {
            "type": "string",
            "description": "e.g. 1990-08-01"
          },
          "url": {
            "type": "string",
            "description": "e.g. https://www.computer.org.example.com/csdl/mags/co/1996/10/rx069-abs.html"
          },
          "summary": {
            "type": "string",
            "description": "Short summary of publication. e.g. Discussion of the World Wide Web, HTTP, HTML."
          }
        }
      }
    },
    "skills": {
      "type": "array",
      "description": "List out your professional skill-set",
      "additionalItems": false,
      "items": {
        "type": "object",
        "additionalProperties": false,
        "properties": {
          "name": {
            "type": "string",
            "description": "e.g. Web Development"
          },
          "priority": {
            "type": "number",
            "description": "controls display/sort order"
          },
          "level": {
            "type": "string",
            "description": "e.g. Master. Currently unused; retained as JSON Resume vocabulary."
          },
          "categories": {
            "type": "array",
            "description": "List categories pertaining to this skill",
            "additionalItems": false,
            "items": {
              "type": "string",
              "description": "e.g. HTML"
            }
          },
          "aliases": {
            "type": "array",
            "description": "Alternate names matched when linking work entries to this skill",
            "additionalItems": false,
            "items": {
              "type": "string",
              "description": "e.g. JS"
            }
          },
          "fullname": {
            "type": "string",
            "description": "Expanded name shown in place of the short name, e.g. Cascading Style Sheets"
          },
          "url": {
            "description": "Reference link for this skill, e.g. https://www.typescriptlang.org. Empty string means no link.",
            "anyOf": [
              { "type": "string", "format": "uri" },
              { "type": "string", "maxLength": 0 }
            ]
          },
          "hide": {
            "type": "boolean",
            "description": "Omit this skill from display"
          }
        }
      }
    },
    "languages": {
      "type": "array",
      "description": "List any other languages you speak",
      "additionalItems": false,
      "items": {
        "type": "object",
        "additionalProperties": true,
        "properties": {
          "language": {
            "type": "string",
            "description": "e.g. English, Spanish"
          },
          "fluency": {
            "type": "string",
            "description": "e.g. Fluent, Beginner"
          }
        }
      }
    },
    "interests": {
      "type": "array",
      "additionalItems": false,
      "items": {
        "type": "object",
        "additionalProperties": true,
        "properties": {
          "name": {
            "type": "string",
            "description": "e.g. Philosophy"
          },
          "skills": {
            "type": "array",
            "additionalItems": false,
            "items": {
              "type": "string",
              "description": "e.g. Friedrich Nietzsche"
            }
          }
        }
      }
    },
    "references": {
      "type": "array",
      "description": "List references you have received",
      "additionalItems": false,
      "items": {
        "type": "object",
        "additionalProperties": true,
        "properties": {
          "name": {
            "type": "string",
            "description": "e.g. Timothy Cook"
          },
          "reference": {
            "type": "string",
            "description": "e.g. Joe blogs was a great employee, who turned up to work at least once a week. He exceeded my expectations when it came to doing nothing."
          }
        }
      }
    },
    "projects": {
      "type": "array",
      "description": "Specify career projects",
      "additionalItems": false,
      "items": {
        "type": "object",
        "additionalProperties": true,
        "properties": {
          "name": {
            "type": "string",
            "description": "e.g. The World Wide Web"
          },
          "description": {
            "type": "string",
            "description": "Short summary of project. e.g. Collated works of 2017."
          },
          "highlights": {
            "type": "array",
            "description": "Specify multiple features",
            "additionalItems": false,
            "items": {
              "type": "string",
              "description": "e.g. Directs you close but not quite there"
            }
          },
          "skills": {
            "type": "array",
            "description": "Specify special elements involved",
            "additionalItems": false,
            "items": {
              "type": "string",
              "description": "e.g. AngularJS"
            }
          },
          "startDate": {
            "type": "string",
            "description": "resume.json uses the ISO 8601 date standard e.g. 2014-06-29",
            "format": "date"
          },
          "endDate": {
            "type": "string",
            "description": "e.g. 2012-06-29",
            "format": "date"
          },
          "url": {
            "type": "string",
            "format": "uri",
            "description": "e.g. https://www.computer.org/csdl/mags/co/1996/10/rx069-abs.html"
          },
          "roles": {
            "type": "array",
            "description": "Specify your role on this project or in company",
            "additionalItems": false,
            "items": {
              "type": "string",
              "description": "e.g. Team Lead, Speaker, Writer"
            }
          },
          "entity": {
            "type": "string",
            "description": "Specify the relevant company/entity affiliations e.g. 'greenpeace', 'corporationXYZ'"
          },
          "type": {
            "type": "string",
            "description": " e.g. 'volunteering', 'presentation', 'talk', 'application', 'conference'"
          }
        }
      }
    },
    "meta": {
      "type": "object",
      "description": "The schema version and any other tooling configuration lives here",
      "additionalProperties": true,
      "properties": {
        "canonical": {
          "type": "string",
          "description": "URL (as per RFC 3986) to latest version of this document"
        },
        "version": {
          "type": "string",
          "description": "A version field which follows semver - e.g. v1.0.0"
        },
        "lastModified": {
          "type": "string",
          "description": "Using ISO 8601 with YYYY-MM-DDThh:mm:ss"
        }
      }
    },
    "skillCategories": {
      "type": "array",
      "items": {
        "type": "string",
        "uniqueItems": true
      }
    },
    "citizenship": {
      "type": "array",
      "items": {
        "type": "object",
        "properties": {
          "country": {
            "type": "string"
          },
          "status": {
            "type": "string"
          }
        }
      }
    },
    "accomplishments": {
      "type": "array",
      "items": {
        "type": "object",
        "properties": {
          "text": {
            "type": "string"
          },
          "showOnShort": {
            "type": "boolean"
          }
        }
      }
    },
    "qualities": {
      "type": "array",
      "items": {
        "type": "string",
        "uniqueItems": true
      }
    }
  }
}