{
  "$schema": "./schema.json",
  "basics": {
    "name": "Douglas Kent",
    "label": "Applied AI & Blockchain Software Engineer · End-to-End Product Engineer · Technical Leader and Mentor",
    "metaTitle": "Douglas Kent — Applied AI & Blockchain Software Engineer",
    "metaDescription": "Software engineer and architect who owns projects end to end: applied AI and LLM systems, blockchain and Web3 platforms, and full-stack web applications.",
    "bio": "Douglas Kent is a software engineer and architect who takes projects across all their dimensions: the people they serve, the context they have to work in, their design and architecture, the build, and the proof that they work. Startups have repeatedly brought him in as their first engineer, and he has been building software professionally since 1985, across web applications, blockchain and Web3 platforms, and AI-native applications. His recent work is applied AI: applications in which language models do the core work, built to be reliable on top of subjective inputs and non-deterministic models.",
    "image": "https://www.douglaskent.com/og-preview.png",
    "email": "resume@douglaskent.com",
    "resumeFeedbackEmail": "resume-feedback@douglaskent.com",
    "phone": "+1 (512) 402-8735 (US)",
    "phone2": "+506 8591-5302 (CR)",
    "website": "https://www.douglaskent.com",
    "summary1": "I am a software engineer and architect who takes a project across all its dimensions: the people it serves, the context it has to work in, its design and architecture, the build, and the proof that it works. Startups have repeatedly brought me in as their first engineer, and I have been building software professionally since 1985, across web applications, blockchain and Web3 platforms, and AI-native applications.",
    "summary2": "I have worn multiple hats in important roles across many kinds of organizations, from Microsoft to garage startups — enough to recognize most problems before they become expensive. I have managed teams, but I do my best work as a hands-on technical lead, including mentoring the developers around me.",
    "summary3": "Please see my complete resume at: <a href='https://www.douglaskent.com' target='_blank' rel='noopener noreferrer'>https://www.douglaskent.com</a>.",
    "summary4": "Lived and worked for decades in both the U.S. and Canada, now based in Costa Rica. I have worked with distributed teams across Europe, Israel, India, and Australia, including leading offshore development teams in daily coordination.",
    "summary5": "I've worked with the likes of Microsoft, garage startups such as ConnectSoft, to Curve Labs where I led the development of a ReFi dApp front end designed to emerge a regenerative, decentralized economic system for the sovereign island nation of Curaçao.",
    "summary6": "I hope we can develop a mutually-beneficial and antifragile relationship together. Thanks for your interest and please read on!",
    "summary7": "My recent work is applied AI: AI-native applications in which language models do the core work, built to be reliable on top of subjective inputs and non-deterministic models. That means evaluation that measures what a model invents as well as what it misses, and a person approving anything that reaches a client.",
    "summary8": "I'm looking for a senior, hands-on technical role in applied or forward-deployed AI, architecture, or staff-level engineering, where I can own a problem end to end, whether at an established company bringing AI into its products or at an AI-native one. I work remotely from Costa Rica, which overlaps well with US business hours, and am happy to travel as needed.",
    "location": {
      "address": "Alegria Village",
      "postalCode": "20401",
      "city": "San Mateo",
      "countryCode": "CR",
      "region": "Alajuela",
      "countryName": "Costa Rica"
    },
    "profiles": [
      {
        "network": "Email",
        "url": "mailto:resume@douglaskent.com",
        "icon": "fa-regular fa-envelope"
      },
      {
        "network": "Website",
        "url": "https://www.douglaskent.com",
        "icon": "fa-solid fa-arrow-up-right-from-square"
      },
      {
        "network": "LinkedIn",
        "url": "https://www.linkedin.com/in/douglas-kent-760876a/",
        "icon": "fa-brands fa-linkedin"
      },
      {
        "network": "GitHub",
        "url": "https://github.com/dkent600",
        "icon": "fa-brands fa-github"
      }
    ]
  },
  "areasOfExpertise": [
    "Applied AI and LLM Applications",
    "AI-Assisted and Agentic Engineering",
    "Blockchain dApps and Smart Contracts",
    "DAO Governance Systems",
    "End-to-End Product Engineering",
    "Technical Leadership and Mentoring",
    "Human-in-the-Loop Systems",
    "AI System Evaluation and Testing",
    "Enterprise APIs and Systems Integration",
    "DeFi and ReFi",
    "Software Project Management",
    "Decision and Risk Analysis"
  ],
  "accomplishments": [
    {
      "text": "Working with subjective human voices and non-deterministic AI interpretations, I led the design and development of Human Lens, an AI-native qualitative analysis application designed to produce findings solid enough for a DEI consultancy to advise its clients with confidence.",
      "showOnShort": true
    },
    {
      "text": "With Curve Labs, I coded, delivered and led, in some cases single-handedly, the front-end development of multiple complex Web3 dApps leveraging Ethereum smart contracts in the domains of decentralized finance (DeFi) and regeneration (ReFi).",
      "showOnShort": true
    },
    {
      "text": "With DAOstack, I helped design and develop some of the first-ever decentralized autonomous organization (DAO) Ethereum smart contracts, and helped develop a complex Web3 dApp to use them.",
      "showOnShort": true
    },
    {
      "text": "In an enterprise website environment at Revionics, I saved a project in jeopardy of missing its deadline. I took the counter-intuitive and risky step of dropping the assisting team from 7 to 3, but it enabled us to meet our deadline.",
      "showOnShort": true
    },
    {
      "text": "At Microsoft, I led a multi-disciplinary development team of 7 software engineers plus writers and graphic designers to produce a multimedia CD-ROM title for Windows. We delivered on time, meeting all quality goals.",
      "showOnShort": true
    },
    {
      "text": "Throughout my career, I have applied my expertise in decision and risk analysis to promote efficient, risk-aware, and antifragile decision-making.",
      "showOnShort": true
    },
    {
      "text": "On a Microsoft project whose development lead and content developer each unexpectedly and simultaneously departed, I took the initiative to undertake some of each person's responsibilities, keeping the project on schedule and leading it to a successful market release.",
      "showOnShort": false
    },
    {
      "text": "In an enterprise website environment at ShiftWise, while facing an urgent deadline, I single-handedly implemented a complete system for handling mission-critical SMS messages. The architecture spanned a web site, three web services, two Windows services, and two SQL Server databases.",
      "showOnShort": false
    },
    {
      "text": "For Ford Motor Company (via Trilogy) I designed, wrote, and delivered ahead of schedule a framework that served content to every page of the company&#39;s flagship website, Ford.com.",
      "showOnShort": false
    },
    {
      "text": "At ConnectSoft I led the development of an application that won a <i>Windows 100</i> award from <i>Windows Magazine</i>: <i>Clip-Art Window Shopper</i>, one of the first ever applications for purchasing and downloading clip-art online — in the early 1990s, before the commercial web existed.",
      "showOnShort": false
    },
    {
      "text": "At Microsoft, I incorporated the new technology of OLE 1.0 into Windows Write. OLE was a highly visible and strategic initiative of interest at the highest levels in Microsoft.",
      "showOnShort": false
    },
    {
      "text": "In my very first job as a software engineer, at the University of N. Carolina, I wrote a multi-dimensional data visualization application that was adopted as a product by the SAS Institute, a major statistical software company.",
      "showOnShort": false
    }
  ],
  "references": [
    {
      "name": "Renç Korzay",
      "reference": "Doug is a brilliant front-end engineer who stands out for his exceptional professionalism, team-player attitude, and a strong sense of ownership. He goes out of his way to ensure that projects are delivered on time and to the highest possible standard. Doug is great at leading other developers and working across disciplines, he's an expert in prioritization and can dissect complex problems. His perfectionism and ability to set a great example for the team have been invaluable. I had the chance to work with Doug on multiple Web3 projects throughout the years and I would always look forward to an opportunity to work with him.",
      "title": "Web3 Product Manager",
      "company": "Curve Labs",
      "website": "https://www.linkedin.com/in/renckorzay/"
    },
    {
      "name": "Ghalem Ben Nouna",
      "reference": "It's rare that you come across standout talent like Doug. I hired Doug as an application developer in my analytics team at PSP. He was able to complete the development of complex data products with complex custom visualizations on time. I was particularly impressed by Doug’s ability to precisely understand business requirements effortlessly due to his extensive experience as well as being an amazing team player.",
      "title": "Senior Director of Data Management and Business Intelligence at Ivanhoé Cambridge",
      "company": "PSP Investments",
      "website": "https://www.linkedin.com/in/ghalem-ben-nouna-2356011/"
    },
    {
      "name": "Ross Barbieri",